{"artifactCount":7,"artifacts":[{"byteCount":501,"path":"baseline-candidate.json","schema":"urn:marginbench:candidate:v1","sha256":"99fb5cfd3d659b412e66b4d34215120b3c324a07a8e411114ad0c72201c38dfb"},{"byteCount":501,"path":"candidate.json","schema":"urn:marginbench:candidate:v1","sha256":"893f165b90cde9a9ca9ee7e2a3e3b1ae71ebfcbe6445ab185758a4294a406868"},{"byteCount":638,"path":"comparison.json","schema":"urn:marginbench:paired-comparison:v1","sha256":"d10d1d5ebd2fb4f917ba4f7a1aaee1d61e44e50e2fc713fd5b53d226aa7c1ba4"},{"byteCount":1561,"path":"execution-plan.json","schema":"urn:marginbench:execution-plan:v1","sha256":"46ab5cadbb9fea77c6526ecaf9fd5fa30b8ab54be567c4f6570c5a89ebedd57b"},{"byteCount":4358,"path":"runs/0000.json","schema":"urn:marginbench:run:v1","sha256":"3dbd5f72bf2c6ff1fffdf1d16c14509360ccb63fe9e05b92f768f528631ee58e"},{"byteCount":4350,"path":"runs/0001.json","schema":"urn:marginbench:run:v1","sha256":"1d9382664db9177f5767bd9e0889731432ef89c5e25bf2aa09536c90e6960b47"},{"byteCount":895,"path":"study-plan.json","schema":"urn:marginbench:study-plan:v1","sha256":"9d094763c93bf3172482aefe02654a5b81758759fdce26cc0763630d25e725f6"}],"error":null,"errors":[],"manifestSha256":"6de268d6eb693ea500112b7d300ce6e45b5aec3675f9469650b601f5c08cd713","schema":"urn:marginbench:submission-verification:v1","submissionID":"sha256:5b95234b52339fad222c36b6bdbb5393d6d8f2d34860514f4a61bc39788568e0","valid":true}